{
  "decision_format": "directive-architecture-adoption-decision-1.0",
  "source_id": "dw-src-openmoss-review-feedback-lib",
  "adoption_date": "2026-03-23",
  "source_analysis_ref": "architecture/02-experiments/2026-03-23-openmoss-review-feedback-lib-source-analysis.md",
  "adaptation_decision_ref": "architecture/02-experiments/2026-03-23-openmoss-review-feedback-lib-adaptation.md",
  "usefulness_level": "meta",
  "readiness_check": {
    "source_analysis_complete": true,
    "adaptation_decision_complete": true,
    "adaptation_quality_acceptable": true,
    "delta_evidence_present": true,
    "no_unresolved_baggage": true
  },
  "artifact_type": "shared-lib",
  "artifact_path": "shared/lib/lifecycle-review-feedback.ts",
  "adaptation_quality": "strong",
  "improvement_quality": "strong",
  "self_improvement": {
    "category": "evaluation_quality",
    "claim": "Directive review and lifecycle loops will drift less because lifecycle and score-feedback behavior now exists as one canonical helper.",
    "mechanism": "Lifecycle transition validation, review-score deltas, and blocked recovery planning are now implemented in one product-owned shared lib.",
    "baseline_observation": "Directive Workspace had lifecycle and score-feedback contracts but no canonical executable helper implementing them.",
    "expected_effect": "Later review-oriented Architecture work can import one helper instead of re-deriving transition and score logic from prose.",
    "verification_method": "structural_inspection",
    "verification_result": "confirmed",
    "verification_date": "2026-03-23",
    "verification_notes": "The helper is now consumed by the Architecture review-resolution lane."
  },
  "decision": {
    "verdict": "adopt",
    "rationale": "The mechanism passed review, met adoption readiness, and remains valuable as Directive-owned Architecture output.",
    "completion_status": "product_materialized",
    "runtime_threshold_check": "yes - the mechanism is still valuable without a runtime surface, so Architecture should retain product-owned value"
  }
}
