{
  "decision_format": "directive-architecture-adoption-decision-1.0",
  "source_id": "dw-pressure-engine-legacy-runtime-active-follow-up-focus-compatibility-2026-03-28",
  "adoption_date": "2026-03-28",
  "source_analysis_ref": "architecture/02-experiments/2026-03-28-dw-pressure-engine-legacy-runtime-active-follow-up-focus-compatibility-2026-03-28-engine-handoff.md",
  "adaptation_decision_ref": "architecture/02-experiments/2026-03-28-dw-pressure-engine-legacy-runtime-active-follow-up-focus-compatibility-2026-03-28-bounded-result-adoption-decision.json",
  "usefulness_level": "meta",
  "readiness_check": {
    "source_analysis_complete": true,
    "adaptation_decision_complete": true,
    "adaptation_quality_acceptable": true,
    "delta_evidence_present": true,
    "no_unresolved_baggage": true
  },
  "artifact_type": "shared-lib",
  "artifact_path": "architecture/03-adopted/2026-03-28-dw-pressure-engine-legacy-runtime-active-follow-up-focus-compatibility-2026-03-28-adopted-planned-next.md",
  "adaptation_quality": "strong",
  "improvement_quality": "strong",
  "self_improvement": {
    "category": "evaluation_quality",
    "claim": "Directive Workspace can improve whole-product truth quality by letting the canonical report and workbench detail inspect the structured historical Scientify Runtime follow-up directly.",
    "mechanism": "This DEEP Architecture case materializes active-bounded legacy Runtime follow-up compatibility inside the shared state resolver and workbench follow-up detail fallback.",
    "baseline_observation": "Before this DEEP opener, the structured Scientify `runtime-followup.md` artifact was still treated as a broken deferred-contract case.",
    "expected_effect": "Historical Runtime follow-up inspection becomes explicit, bounded, and reportable without inventing new Runtime v0 advancement.",
    "verification_method": "structural_inspection",
    "verification_result": "not_yet_verified"
  },
  "decision": {
    "verdict": "adopt",
    "rationale": "The canonical truth anchor and workbench follow-up detail should resolve the structured historical Scientify Runtime follow-up as read-only history.",
    "completion_status": "product_partial",
    "runtime_threshold_check": "yes - the mechanism is still valuable without a runtime surface, so Architecture should retain product-owned value"
  }
}
