{
  "decision_format": "directive-architecture-adoption-decision-1.0",
  "source_id": "dw-pressure-gpt-researcher-evaluator-quality-2026-03-25",
  "adoption_date": "2026-04-06",
  "source_analysis_ref": "architecture/01-experiments/2026-03-25-dw-pressure-gpt-researcher-evaluator-quality-2026-03-25-engine-handoff.md",
  "adaptation_decision_ref": "architecture/01-experiments/2026-03-25-dw-pressure-gpt-researcher-evaluator-quality-2026-03-25-bounded-result-adoption-decision.json",
  "usefulness_level": "meta",
  "readiness_check": {
    "source_analysis_complete": true,
    "adaptation_decision_complete": true,
    "adaptation_quality_acceptable": true,
    "delta_evidence_present": true,
    "no_unresolved_baggage": true
  },
  "artifact_type": "shared-lib",
  "artifact_path": "architecture/02-adopted/2026-03-25-dw-pressure-gpt-researcher-evaluator-quality-2026-03-25-adopted.md",
  "adaptation_quality": "strong",
  "improvement_quality": "strong",
  "self_improvement": {
    "category": "evaluation_quality",
    "claim": "Directive Workspace can carry this bounded Architecture slice forward into direct adoption without reopening the prior Engine, handoff, and post-consumption evidence chain by hand.",
    "mechanism": "The bounded closeout now records an adoption-ready Architecture result and paired decision artifact directly on the bounded-result record.",
    "baseline_observation": "Before this closeout, the reopened bounded slice still depended on manual interpretation to decide whether it could move forward as retained Directive-owned Architecture output.",
    "expected_effect": "The bounded result 'Updated shared/lib/architecture-bounded-closeout.ts to require explicit validation-method naming for evaluator-oriented bounded results instead of treating proof as a bare boolean. Proof executed by npm.cmd run check plus structural inspection of the GPT Researcher reviewer-criteria, SimpleQA, and hallucination-eval source signals; the concrete code delta is C:/Users/User/.openclaw/workspace/directive-workspace/shared/lib/architecture-bounded-closeout.ts.' can now move directly into the normal adoption/materialization path as Architecture-owned output.",
    "verification_method": "structural_inspection"
  },
  "decision": {
    "verdict": "adopt",
    "rationale": "The bounded result is explicitly adopted as current-scope Directive-owned Architecture output.",
    "completion_status": "product_materialized",
    "runtime_threshold_check": "yes - the mechanism is still valuable without a runtime surface, so Architecture should retain product-owned value"
  }
}

