{
  "decision_format": "directive-architecture-adoption-decision-1.0",
  "source_id": "dw-src-architecture-cycle-decision-summary-lib",
  "adoption_date": "2026-03-23",
  "usefulness_level": "meta",
  "readiness_check": {
    "source_analysis_complete": true,
    "adaptation_decision_complete": true,
    "adaptation_quality_acceptable": true,
    "delta_evidence_present": true,
    "no_unresolved_baggage": true
  },
  "artifact_type": "shared-lib",
  "artifact_path": "shared/lib/architecture-cycle-decision-summary.ts",
  "adaptation_quality": "strong",
  "improvement_quality": "strong",
  "self_improvement": {
    "category": "evaluation_quality",
    "claim": "Architecture cycle evaluation will compare waves more reliably because generated adoption artifacts can now be summarized directly into decision metrics.",
    "mechanism": "The cycle-decision summary helper aggregates verdict, usefulness, artifact-type, completion-status, Runtime-handoff, and self-improvement-category counts from machine-readable adoption artifacts.",
    "baseline_observation": "Cycle evaluation templates had no executable lane for aggregating decision composition from generated adoption artifacts.",
    "expected_effect": "Future cycle evaluations can anchor decision composition to generated artifacts instead of only prose adopted records.",
    "verification_method": "structural_inspection",
    "verification_result": "confirmed",
    "verification_date": "2026-03-23",
    "verification_notes": "This slice now has an on-disk decision-artifact corpus and a corpus checker consuming it."
  },
  "decision": {
    "verdict": "adopt",
    "rationale": "The mechanism passed review, met adoption readiness, and remains valuable as Directive-owned Architecture output.",
    "completion_status": "product_materialized",
    "runtime_threshold_check": "yes - the mechanism is still valuable without a runtime surface, so Architecture should retain product-owned value"
  }
}
