{
  "decision_format": "directive-architecture-adoption-decision-1.0",
  "source_id": "dw-pressure-engine-legacy-runtime-transformation-label-link-normalization-2026-03-28",
  "adoption_date": "2026-03-28",
  "source_analysis_ref": "architecture/01-experiments/2026-03-28-dw-pressure-engine-legacy-runtime-transformation-label-link-normalization-2026-03-28-engine-handoff.md",
  "adaptation_decision_ref": "architecture/01-experiments/2026-03-28-dw-pressure-engine-legacy-runtime-transformation-label-link-normalization-2026-03-28-bounded-result-adoption-decision.json",
  "usefulness_level": "meta",
  "readiness_check": {
    "source_analysis_complete": true,
    "adaptation_decision_complete": true,
    "adaptation_quality_acceptable": true,
    "delta_evidence_present": true,
    "no_unresolved_baggage": true
  },
  "artifact_type": "shared-lib",
  "artifact_path": "architecture/02-adopted/2026-03-28-dw-pressure-engine-legacy-runtime-transformation-label-link-normalization-2026-03-28-adopted-planned-next.md",
  "adaptation_quality": "strong",
  "improvement_quality": "strong",
  "self_improvement": {
    "category": "evaluation_quality",
    "claim": "Directive Workspace can improve whole-product truth quality by treating descriptive label-style transformation references as notes instead of broken artifact links.",
    "mechanism": "This DEEP Architecture case materializes label-link normalization inside the shared state resolver.",
    "baseline_observation": "Before this DEEP opener, the two remaining label-style historical transformation records still resolved as broken because the resolver treated descriptive `this record (...)` values as linked artifact paths.",
    "expected_effect": "Historical Runtime transformation inspection remains explicit, bounded, and read-only while the final descriptive label-style failures are removed.",
    "verification_method": "structural_inspection",
    "verification_result": "not_yet_verified"
  },
  "decision": {
    "verdict": "adopt",
    "rationale": "The canonical truth anchor should normalize descriptive label-style transformation references into note fields instead of broken links.",
    "completion_status": "product_partial",
    "runtime_threshold_check": "yes - the mechanism is still valuable without a runtime surface, so Architecture should retain product-owned value"
  }
}

