{
  "decision_format": "directive-architecture-adoption-decision-1.0",
  "source_id": "dw-source-promptwizard-2026-03-28",
  "adoption_date": "2026-03-28",
  "usefulness_level": "meta",
  "readiness_check": {
    "source_analysis_complete": true,
    "adaptation_decision_complete": true,
    "adaptation_quality_acceptable": true,
    "delta_evidence_present": true,
    "no_unresolved_baggage": true
  },
  "artifact_type": "template",
  "artifact_path": "architecture/01-experiments/2026-03-28-dw-source-promptwizard-2026-03-28-bounded-result.md",
  "adaptation_quality": "adequate",
  "improvement_quality": "skipped",
  "decision": {
    "verdict": "stay_experimental",
    "rationale": "The mechanism is not adoption-ready yet; keep it experimental until readiness and evidence gaps are closed.",
    "completion_status": "doc_only_or_planned",
    "stay_experimental_reason": "Required proof has not been executed yet.; Meta-useful adoptions must declare a self-improvement category.",
    "runtime_threshold_check": "yes - the mechanism is still valuable without a runtime surface, so Architecture should retain product-owned value"
  }
}

