{
  "decision_format": "directive-architecture-adoption-decision-1.0",
  "source_id": "dw-pressure-engine-stale-current-head-architecture-bounded-result-legality-hardening-2026-03-28",
  "adoption_date": "2026-03-28",
  "source_analysis_ref": "architecture/01-experiments/2026-03-28-dw-pressure-engine-stale-current-head-architecture-bounded-result-legality-hardening-2026-03-28-engine-handoff.md",
  "adaptation_decision_ref": "architecture/01-experiments/2026-03-28-dw-pressure-engine-stale-current-head-architecture-bounded-result-legality-hardening-2026-03-28-bounded-result-adoption-decision.json",
  "usefulness_level": "meta",
  "readiness_check": {
    "source_analysis_complete": true,
    "adaptation_decision_complete": true,
    "adaptation_quality_acceptable": true,
    "delta_evidence_present": true,
    "no_unresolved_baggage": true
  },
  "artifact_type": "shared-lib",
  "artifact_path": "architecture/02-adopted/2026-03-28-dw-pressure-engine-stale-current-head-architecture-bounded-result-legality-hardening-2026-03-28-adopted-planned-next.md",
  "adaptation_quality": "strong",
  "improvement_quality": "strong",
  "self_improvement": {
    "category": "evaluation_quality",
    "claim": "Directive Workspace can stop stale Architecture bounded-result wording from overruling the stronger live currentHead on advanced Architecture chains.",
    "mechanism": "The adopted slice downgrades artifact-local next-step wording for stale Architecture bounded-result artifacts once currentHead has advanced elsewhere.",
    "baseline_observation": "Before this DEEP slice, the shared resolver still advertised the old bounded-result local next step even after currentHead had already moved to a reopened or later downstream Architecture artifact.",
    "expected_effect": "Operators inspecting stale Architecture bounded-result artifacts will be redirected to the live currentHead instead of being shown a no-longer-satisfiable local next step.",
    "verification_method": "structural_inspection",
    "verification_result": "not_yet_verified"
  },
  "decision": {
    "verdict": "adopt",
    "rationale": "The slice is small, shared, and directly aligns artifact-local wording with currentHead truth without rewriting the integrity model.",
    "completion_status": "product_partial",
    "runtime_threshold_check": "yes - the mechanism is still valuable without a runtime surface, so Architecture should retain product-owned value"
  }
}

