{
  "decision_format": "directive-architecture-adoption-decision-1.0",
  "source_id": "dw-pressure-engine-stage-chaining-discovery-control-verification-2026-03-28",
  "adoption_date": "2026-03-28",
  "source_analysis_ref": "architecture/01-experiments/2026-03-28-dw-pressure-engine-stage-chaining-discovery-control-verification-2026-03-28-engine-handoff.md",
  "adaptation_decision_ref": "architecture/01-experiments/2026-03-28-dw-pressure-engine-stage-chaining-discovery-control-verification-2026-03-28-bounded-result-adoption-decision.json",
  "usefulness_level": "meta",
  "readiness_check": {
    "source_analysis_complete": true,
    "adaptation_decision_complete": true,
    "adaptation_quality_acceptable": true,
    "delta_evidence_present": true,
    "no_unresolved_baggage": true
  },
  "artifact_type": "shared-lib",
  "artifact_path": "architecture/02-adopted/2026-03-28-dw-pressure-engine-stage-chaining-discovery-control-verification-2026-03-28-adopted-planned-next.md",
  "adaptation_quality": "strong",
  "improvement_quality": "strong",
  "self_improvement": {
    "category": "evaluation_quality",
    "claim": "Directive Workspace can improve future Engine self-improvement quality by proving staged shared-Engine refactors preserve Discovery behavior too.",
    "mechanism": "This DEEP Architecture case materializes one Discovery control check inside the staged Engine verification script.",
    "baseline_observation": "Before this DEEP opener, Discovery no-drift confidence depended on ad hoc command inspection.",
    "expected_effect": "Future shared Engine refactors will fail quickly if they alter the Discovery lane's default proof or integration behavior.",
    "verification_method": "structural_inspection",
    "verification_result": "not_yet_verified"
  },
  "decision": {
    "verdict": "adopt",
    "rationale": "The staged Engine verification is worth extending with a Discovery control path.",
    "completion_status": "product_partial",
    "runtime_threshold_check": "yes - the mechanism is still valuable without a runtime surface, so Architecture should retain product-owned value"
  }
}

