{
  "decision_format": "directive-architecture-adoption-decision-1.0",
  "source_id": "dw-pressure-agentics-reporting-boundary-2026-03-26",
  "adoption_date": "2026-04-06",
  "source_analysis_ref": "architecture/01-experiments/2026-03-26-dw-pressure-agentics-reporting-boundary-2026-03-26-engine-handoff.md",
  "adaptation_decision_ref": "architecture/01-experiments/2026-03-26-dw-pressure-agentics-reporting-boundary-2026-03-26-bounded-result-adoption-decision.json",
  "usefulness_level": "meta",
  "readiness_check": {
    "source_analysis_complete": true,
    "adaptation_decision_complete": true,
    "adaptation_quality_acceptable": true,
    "delta_evidence_present": true,
    "no_unresolved_baggage": true
  },
  "artifact_type": "schema",
  "artifact_path": "architecture/02-adopted/2026-03-26-dw-pressure-agentics-reporting-boundary-2026-03-26-adopted.md",
  "adaptation_quality": "strong",
  "improvement_quality": "strong",
  "self_improvement": {
    "category": "evaluation_quality",
    "claim": "Directive Workspace can carry this bounded Architecture slice forward into direct adoption without reopening the prior Engine, handoff, and post-consumption evidence chain by hand.",
    "mechanism": "The bounded closeout now records an adoption-ready Architecture result and paired decision artifact directly on the bounded-result record.",
    "baseline_observation": "Before this closeout, the reopened bounded slice still depended on manual interpretation to decide whether it could move forward as retained Directive-owned Architecture output.",
    "expected_effect": "The bounded result 'A repeated produced-artifact reporting seam appeared on the first closeout pass: the bounded result inferred the routed handoff stub as the transformed artifact even though this slice had not recorded produced artifacts explicitly. This bounded slice fixes that by adding explicit transformedArtifactsProduced handling to Architecture closeout, result rendering, and the existing closeout surface, while retaining primaryEvidencePath for the canonical direct pointer. Proof used node --experimental-strip-types ./scripts/check-architecture-composition.ts, npm.cmd run check, and real re-read of the rewritten bounded result contract.' can now move directly into the normal adoption/materialization path as Architecture-owned output.",
    "verification_method": "structural_inspection"
  },
  "decision": {
    "verdict": "adopt",
    "rationale": "The bounded result is explicitly adopted as current-scope Directive-owned Architecture output.",
    "completion_status": "product_materialized",
    "runtime_threshold_check": "yes - the mechanism is still valuable without a runtime surface, so Architecture should retain product-owned value"
  }
}

